Key,en_us,pt_br
dlg_tutorial_pause,Pressing <sprite=5> or <sprite=6>: the game will be paused and a new window will open.,Pressionando <sprite=5> ou <sprite=6>: o jogo será pausado e uma nova janela irá se abrir.
,During this window: three buttons will be highlighted& Continue: Options and Exit.,Durante essa janela três botões estaram em destaque& Continuar : Opções e Sair.
,Options will open a new window: where it will possible to change the settings for video: audio and controls. Adjust each setting to your liking.,Opções abrirá uma nova janela: onde será possivel mexer nas configurações de vídeo: audio e controles. Ajuste cada configuração do modo que mais lhe agrade.
,Exit will open a small window: where two options will appear& Return to HQ and Return to Main Menu.,Sair abrirá uma pequena janela: onde duas opções apareceram& Voltar ao QG e Voltar ao Menu Principal.
,Continue will unpause the game: and bring you back into the action: Pressing the <sprite=5> or <sprite=6> buttons again will do the same function.,Continuar irá despausar o jogo: e te trazer de volta para ação. Apertar novamente os botões <sprite=5> ou <sprite=6> fará a mesma função.